{
  "schemaVersion": 1,
  "name": "create-app",
  "preflightProfile": "mobile-e2e",
  "humanGates": ["specification", "acceptance", "release"],
  "stages": ["intake", "risk", "data-classification", "threat-model", "data-protection-contract", "specification", "design-contract", "human-specification", "environment-preflight", "stack-baseline", "scaffold", "backend", "development-build", "vertical-slice", "lower-layer-tests", "data-protection-verification", "agent-device-verification", "independent-review", "operator-checklist", "acceptance", "release-candidate", "final-qa", "release", "observe", "compound"]
}
